{
  "$schema": "http://json-schema.org/draft-07/schema#",
  "title": "CRAFT Deck art pack",
  "description": "One world's look for the whole deck: an image brief, alt text, an optional character bio, and a generated status per card. Never a path - every path is derived from the pack id plus the entry key by scripts/art-pack.mjs.",
  "type": "object",
  "additionalProperties": false,
  "required": [
    "schemaVersion",
    "theme",
    "craft",
    "roles",
    "lineages",
    "archetypes",
    "grades",
    "shared"
  ],
  "properties": {
    "schemaVersion": { "const": 2 },
    "theme": { "$ref": "#/$defs/theme" },
    "craft": {
      "type": "object",
      "propertyNames": { "pattern": "^[A-Z]$" },
      "additionalProperties": { "$ref": "#/$defs/entry" }
    },
    "roles": { "$ref": "#/$defs/entryMap" },
    "lineages": { "$ref": "#/$defs/entryMap" },
    "archetypes": { "$ref": "#/$defs/entryMap" },
    "grades": {
      "type": "object",
      "propertyNames": { "$ref": "#/$defs/id" },
      "additionalProperties": {
        "type": "array",
        "minItems": 1,
        "maxItems": 5,
        "items": { "$ref": "#/$defs/entry" }
      }
    },
    "shared": { "$ref": "#/$defs/entryMap" }
  },
  "$defs": {
    "nonEmptyString": {
      "type": "string",
      "minLength": 1
    },
    "id": {
      "type": "string",
      "pattern": "^[a-z0-9]+(?:-[a-z0-9]+)*$"
    },
    "theme": {
      "type": "object",
      "additionalProperties": false,
      "required": [
        "id",
        "name",
        "filePrefix",
        "fileExtension",
        "generator",
        "aspectRatio",
        "style"
      ],
      "properties": {
        "id": { "$ref": "#/$defs/id" },
        "name": { "$ref": "#/$defs/nonEmptyString" },
        "filePrefix": {
          "type": "string",
          "pattern": "^[A-Z]{2,4}$"
        },
        "fileExtension": {
          "type": "string",
          "enum": ["png", "jpg", "webp"]
        },
        "generator": { "$ref": "#/$defs/nonEmptyString" },
        "aspectRatio": { "$ref": "#/$defs/nonEmptyString" },
        "style": { "$ref": "#/$defs/nonEmptyString" },
        "draft": {
          "type": "boolean",
          "description": "A world still being written. Draft packs are skipped by the generator and the coverage check, so scaffolding one cannot fail the build. Clearing the flag is the moment the pack has to be complete."
        }
      }
    },
    "entry": {
      "type": "object",
      "additionalProperties": false,
      "required": ["prompt", "alt", "status"],
      "properties": {
        "prompt": {
          "type": "string",
          "minLength": 1,
          "description": "The image brief for this card in this world. Capped for the same reason every other free-text field is: a ceiling declared once here beats discovering one later, when something finally edits this field through the studio.",
          "maxLength": 2000
        },
        "alt": {
          "type": "string",
          "minLength": 1,
          "description": "Alt text for the card image.",
          "maxLength": 300
        },
        "bio": {
          "type": "string",
          "minLength": 1,
          "description": "The card's short character blurb, shown in the inspection panel next to its ability. Capped so it cannot push the ability bullets out of a panel that clips silently.",
          "maxLength": 240
        },
        "liveRev": {
          "type": "integer",
          "minimum": 0,
          "description": "Bumped every time the live image is rewritten. The derived path is stable, so without this a cache has no way to know the bytes behind it changed - the studio would apply a new variant and the deck would keep showing the old one. Appended to the browser-facing src as ?v=, never to the filesystem path."
        },
        "liveVariant": {
          "type": "string",
          "pattern": "^[a-z](_cropped)?$",
          "description": "Which candidate under card-art-source/ produced the live image, e.g. \"c\" or \"b_cropped\". Written when a variant is applied and cleared when the live image is removed. Without it the studio cannot tell which candidate is on the card and can only guess - which it did, showing variant \"a\" under the words \"how it reads on the card\"."
        },
        "status": {
          "type": "string",
          "enum": ["planned", "generated"]
        }
      }
    },
    "entryMap": {
      "type": "object",
      "propertyNames": { "$ref": "#/$defs/id" },
      "additionalProperties": { "$ref": "#/$defs/entry" }
    }
  }
}
