{
  "schemaVersion": 2,
  "theme": {
    "id": "sci-fi",
    "name": "Sci-Fi",
    "filePrefix": "SCI",
    "fileExtension": "png",
    "generator": "Higgsfield.ai - Nano Banana Pro (2K)",
    "aspectRatio": "1:1",
    "style": "Modern sci-fi collectible-card key art in a CG and comic-book hybrid style: painterly volumetric rendering carried by clean comic ink weight on the silhouette, cinematic and high-craft, the way a premium video game paints its collectible cards. Cyan and teal key light rakes the subject from one side, a hard cyan rim light separates it from a deep blue-black background, and soft atmospheric haze falls away behind. One strong centered focal shape, isolated, uncluttered edges, nothing in the background competing with it, and it still reads at thumbnail size. Square composition with generous breathing room. Artwork only: no text, no letters, no numbers, no logos, no readable symbols, no UI labels, no card frame."
  },
  "craft": {
    "C": {
      "prompt": "Context. A vast dark situation table where a holographic terrain of the problem resolves out of nothing, a bounded pool of cyan light defining exactly how far the known world extends and open shadow beyond its edge.",
      "alt": "Illustration for the Context letter of the CRAFT acronym.",
      "status": "generated",
      "bio": "Everything the answer is allowed to stand on, and the hard edge where that stops."
    },
    "R": {
      "prompt": "Role. A rank of identical armored crew silhouettes standing in shadow while one steps forward into full cyan key light, its specialist gear catching the beam, the chosen perspective made physical.",
      "alt": "Illustration for the Role letter of the CRAFT acronym.",
      "status": "generated",
      "bio": "One perspective stepped forward out of the rank, because the hardest decision in the work needs a specialist."
    },
    "A": {
      "prompt": "Action. The moment of commitment: a heavy mechanism driving forward along a rail, thrust light blooming behind it, energy discharging in a decisive forward vector across the frame.",
      "alt": "Illustration for the Action letter of the CRAFT acronym.",
      "status": "generated",
      "bio": "The verb. What the work actually does, chosen and driven forward instead of hedged."
    },
    "F": {
      "prompt": "Format. A precision mold closing around molten luminous material and pressing it into one exact geometric form, a clean shaped artifact emerging from formless glow.",
      "alt": "Illustration for the Format letter of the CRAFT acronym.",
      "status": "generated",
      "bio": "The mold. The same findings pressed into the shape the reader can actually use."
    },
    "T": {
      "prompt": "Target audience. A single figure seen from behind at a wide viewport, lit from the front by the transmission arriving for them, the whole scene built around who is receiving it.",
      "alt": "Illustration for the Target audience letter of the CRAFT acronym.",
      "status": "generated",
      "bio": "Whoever is at the other end of the transmission. Everything upstream is aimed at them."
    }
  },
  "roles": {
    "researcher": {
      "prompt": "A xenoarchivist in a modular field rig, half-lit by the cracked data-core she is coaxing back to life, spectral survey planes and annotated star-charts hovering around her hands as she traces one thread back to its origin.",
      "alt": "Illustration asset for the Researcher role.",
      "status": "generated",
      "bio": "Xenoarchivist. She will not cite a source she has not held in her own hands, and she files the ones that contradict her as carefully as the ones that agree."
    },
    "analyst": {
      "prompt": "An analyst standing inside a suspended lattice of readings, pulling two conflicting data strands apart with both hands so the pattern between them resolves, outlier points burning brighter than the rest.",
      "alt": "Illustration asset for the Analyst role.",
      "status": "generated",
      "bio": "Reads two conflicting instruments and refuses to average them. Pulls a claim apart at the seam until the assumption holding it together is visible."
    },
    "strategist": {
      "prompt": "A campaign strategist over a darkened war table, three glowing approach vectors projected above it, one hand hovering to commit while the others dim, distant terrain rendered in wireframe.",
      "alt": "Illustration asset for the Strategist role.",
      "status": "generated",
      "bio": "Runs three approaches over the war table and kills two of them on purpose. What she hands you is the one that survived its own worst case."
    },
    "historian": {
      "prompt": "A chronicler at a towering memory spindle, drawing a single luminous timeline thread out of a vault of stacked archive cores, older layers dimmer and deeper behind.",
      "alt": "Illustration asset for the Historian role.",
      "status": "generated",
      "bio": "Keeper of the memory spindle. Will not tell you what happened until the order is right, because the order is usually the reason."
    },
    "fact-checker": {
      "prompt": "A verification officer holding a claim slab in an authentication clamp, provenance beams shooting from it toward distant source cores, some locking solid and others flickering unresolved.",
      "alt": "Illustration asset for the Fact-checker role.",
      "status": "generated",
      "bio": "Puts a claim in the authentication clamp and traces its provenance back to something solid. If nothing lights up, the claim leaves the room."
    },
    "synthesizer": {
      "prompt": "A signal weaver at a braiding loom, gathering many separate glowing data strands into a single coherent cable, the incompatible strands left visibly standing apart.",
      "alt": "Illustration asset for the Synthesizer role.",
      "status": "generated",
      "bio": "Braids many signals into one cable without hiding the strands that fight. Disagreement stays in the weave, visible and load-bearing."
    },
    "explainer-educator": {
      "prompt": "An instructor unfolding a complex mechanism into a floating exploded diagram, the pieces separating in mid-air along clean cyan guide-lines, one hand steadying the sequence.",
      "alt": "Illustration asset for the Explainer / Educator role.",
      "status": "generated",
      "bio": "Unfolds a mechanism in mid-air and holds it there while you look. Never explains a part before you can see where it sits."
    },
    "comparative-reviewer": {
      "prompt": "A critical reviewer between two suspended prototypes in an inspection bay, stress beams probing both, hairline stress-fractures glowing where each one is weakest.",
      "alt": "Illustration asset for the Critical Reviewer role.",
      "status": "generated",
      "bio": "Runs both prototypes to failure in the same bay under the same load, and finds the hairline crack neither builder wanted found."
    },
    "developer": {
      "prompt": "An engineer wrist-deep in a modular lattice of interlocking components, seating one new part into place while the surrounding structure lights up to accept it.",
      "alt": "Illustration asset for the Developer role.",
      "status": "generated",
      "bio": "Seats a new part into a running lattice without stopping the machine, matching the existing fittings even when he would have chosen different ones."
    },
    "technical-troubleshooter": {
      "prompt": "A diagnostics technician tracing a fault arc through a machine's exposed guts, one glowing break in an otherwise dark circuit, probe held steady at the exact point of failure.",
      "alt": "Illustration asset for the Technical Troubleshooter role.",
      "status": "generated",
      "bio": "Traces the fault arc to the one break instead of replacing the whole run, and will not close the panel until the fix survives the same load twice."
    },
    "systems-designer": {
      "prompt": "A systems architect inside a hovering orbital schematic, moving whole subsystems into relation with each other, data flows drawn as light between them.",
      "alt": "Illustration asset for the Systems Designer role.",
      "status": "generated",
      "bio": "Moves whole subsystems into relation with each other before anything is built. Cares more about how it fails than how it runs."
    },
    "workflow-architect": {
      "prompt": "A pipeline designer above a conveyor of light, rerouting a stalled segment so the flow runs clean, the old bottleneck dark and bypassed beside it.",
      "alt": "Illustration asset for the Workflow Architect role.",
      "status": "generated",
      "bio": "Reroutes a stalled line so the flow runs clean and leaves the necessary checks standing. The bottleneck goes; the safeguards do not."
    },
    "ux-ui-advisor": {
      "prompt": "An interface ergonomist testing a control surface with a gloved hand, heat-bloom showing where the reach is awkward, a cleaner layout ghosted over the old one.",
      "alt": "Illustration asset for the UX / UI Advisor role.",
      "status": "generated",
      "bio": "Tests a control surface with a gloved hand and watches for heat-bloom where the reach goes wrong. Trusts the hand over the drawing."
    },
    "data-analyst": {
      "prompt": "A data diver suspended in a dense particle field of measurements, cupping a cluster where the signal concentrates, sparse noise drifting away at the edges.",
      "alt": "Illustration asset for the Data Analyst role.",
      "status": "generated",
      "bio": "Suspended in the particle field, cupping the cluster where the signal actually concentrates. Names the caveat in the same breath as the finding."
    },
    "qa-test-engineer": {
      "prompt": "A stress-test operator deliberately driving a prototype past its limits inside a reinforced bay, the exact failure point flaring bright as the structure gives.",
      "alt": "Illustration asset for the QA / Test Engineer role.",
      "status": "generated",